,TweetId,User,Tweet,Time,nb_retweets,nb_favorites
0,1599382943893319680,elonmusk,intellig hive mind improv signific signal nois effect cross link tweet amp,2022-12-04 12:39:43+00:00,14772,170200
1,1599325924431798272,elonmusk,anyth anyon use court law,2022-12-04 08:53:09+00:00,26828,399980
2,1599261195470372866,elonmusk,twitter improv signal nois ratio less relev convent news becom,2022-12-04 04:35:56+00:00,26999,283763
3,1599259281584402432,elonmusk,tree thought,2022-12-04 04:28:20+00:00,7610,88731
4,1599258460121538560,elonmusk,great work twitter space team,2022-12-04 04:25:04+00:00,7956,84909
5,1599228101547868160,elonmusk,pretti wild engag back forth dialogu 100k peopl live twitter space,2022-12-04 02:24:26+00:00,18978,266098
6,1599226433976795136,elonmusk,rt call busi profession visit smb resourc page download guid get,2022-12-04 02:17:48+00:00,1791,0
7,1599224347121500160,elonmusk,express opinion promis conduct poll assang snowden pardon,2022-12-04 02:09:31+00:00,53307,137394
8,1599205091294052352,elonmusk,note thank advertis return twitter,2022-12-04 00:53:00+00:00,35548,547351
9,1599158458615746561,elonmusk,sbf bad leagu nuff,2022-12-03 21:47:42+00:00,11315,177178
10,1598989666812071936,elonmusk,twitter server run warp 9,2022-12-03 10:36:59+00:00,41922,506807
11,1598864377750306816,elonmusk,tune episod 2 twitter file tomorrow,2022-12-03 02:19:07+00:00,64812,613920
12,1598825403182874625,elonmusk,go,2022-12-02 23:44:15+00:00,88841,398265
13,1598778884639653891,elonmusk,realli happen hunter biden stori suppress twitter publish twitter 5pm et,2022-12-02 20:39:24+00:00,106732,715126
14,1598770563597606917,elonmusk,major twitter system improv implement week drop hammer hard spam scam account take jus,2022-12-02 20:06:20+00:00,8754,66534
15,1598765633121898496,elonmusk,twitter now serv 90 billion tweet impress per day incred aliv system actual,2022-12-02 19:46:45+00:00,19170,237137
16,1598752139278532610,elonmusk,hate speech impress time tweet view continu declin despit signific user growth,2022-12-02 18:53:08+00:00,12805,121663
17,1598718904830132225,elonmusk,know twitter fair extremist far right far left simultan upset twitter aim,2022-12-02 16:41:04+00:00,41858,503439
18,1598714331872780288,elonmusk,rt thank join live stream hear progress team made last year case miss,2022-12-02 16:22:54+00:00,2055,0
19,1598548365364498432,elonmusk,fafo,2022-12-02 05:23:24+00:00,14251,198173
20,1598501091720630272,elonmusk,rt tesla semi drive 500 mile fulli load singl charg,2022-12-02 02:15:33+00:00,9538,0
21,1598482808020029441,elonmusk,tesla semi truck launch 5 min,2022-12-02 01:02:54+00:00,8305,101550
22,1598477759730581504,elonmusk,go live twitter 20 min,2022-12-02 00:42:50+00:00,4116,52756
23,1598420481769512960,elonmusk,congratul japan,2022-12-01 20:55:14+00:00,83831,721034
24,1598414428525199360,elonmusk,ai get realli good,2022-12-01 20:31:11+00:00,6225,58910
25,1598381157124837376,elonmusk,meet mani peopl read twitter day never tweet beg indulg pleas add,2022-12-01 18:18:59+00:00,48457,605675
26,1598360883474108417,elonmusk,lot peopl stuck damn crazi chatgpt loop,2022-12-01 16:58:25+00:00,6010,82054
27,1598337312446087168,elonmusk,remind tap star icon upper right screen switch latest peopl follow recommend tweet,2022-12-01 15:24:45+00:00,13914,158628
28,1598157971384463360,elonmusk,twitter purg lot spam scam account right now see follow count drop,2022-12-01 03:32:07+00:00,69419,705574
29,1598127347932090370,elonmusk,excit neuralink updat 30 min,2022-12-01 01:30:26+00:00,4662,56677
30,1598050795882442752,elonmusk,thank take around appl s beauti hq,2022-11-30 20:26:14+00:00,26399,448593
31,1598028229784506369,elonmusk,rt twitter 2 0 mission faster innov transpar,2022-11-30 18:56:34+00:00,7500,0
32,1598002191767580672,elonmusk,rt falcon 9 vertic pad 40 florida ahead launch hakuto r mission 1 first privat led japan,2022-11-30 17:13:06+00:00,3361,0
33,1597982424629383168,elonmusk,updat 6pm pt,2022-11-30 15:54:33+00:00,8823,112110
34,1597829226572705793,elonmusk,twitter core servic latenc reduc 400ms feel notic faster,2022-11-30 05:45:48+00:00,21067,328613
35,1597735092247736322,elonmusk,littl progress mar,2022-11-29 23:31:45+00:00,10738,142776
36,1597405399040217088,elonmusk,battl futur civil free speech lost even america tyranni lie ahead,2022-11-29 01:41:40+00:00,146173,921312
37,1597404145421414400,elonmusk,rt look forward world found upon four essenti human freedom first freedom speech express everywh,2022-11-29 01:36:41+00:00,8898,0
38,1597336812732575744,elonmusk,twitter file free speech suppress soon publish twitter public deserv know realli happen,2022-11-28 21:09:07+00:00,132813,856928
39,1597331151211069440,elonmusk,rt appl transpar process probabl monopoli,2022-11-28 20:46:38+00:00,4718,0
40,1597331143158034433,elonmusk,rt appl support free speech,2022-11-28 20:46:36+00:00,20235,0
41,1597301968208556032,elonmusk,know appl put secret 30 tax everyth buy app store,2022-11-28 18:50:40+00:00,44328,261235
42,1597300125243944961,elonmusk,appl threaten withhold twitter app store tell,2022-11-28 18:43:20+00:00,77795,671744
43,1597295832759382016,elonmusk,appl publish censorship action taken affect custom,2022-11-28 18:26:17+00:00,37172,189463
44,1597293917707587585,elonmusk,accur,2022-11-28 18:18:40+00:00,25643,225825
45,1597291218714906626,elonmusk,appl censor,2022-11-28 18:07:57+00:00,21943,150391
46,1597285572699074560,elonmusk,appl most stop advertis twitter hate free speech america,2022-11-28 17:45:31+00:00,66390,640548
47,1597280496525844481,elonmusk,,2022-11-28 17:25:21+00:00,16245,160805
48,1597183438779342849,elonmusk,,2022-11-28 10:59:40+00:00,17373,174177
49,1597170780130852864,elonmusk,,2022-11-28 10:09:22+00:00,52762,477029
50,1597165510595989504,elonmusk,bedsid tabl,2022-11-28 09:48:26+00:00,58265,895561
51,1597164398543777792,elonmusk,amount pro psi op twitter ridicul new verifi pay 8 privileg haha,2022-11-28 09:44:01+00:00,14795,186692
52,1597032623020249088,elonmusk,twitter experienc slight degrad servic today old 3rd parti tool use block account,2022-11-28 01:00:23+00:00,17220,242604
53,1596942103937921025,elonmusk,note encourag peopl differ polit view engag civil debat twitter worst,2022-11-27 19:00:41+00:00,29790,323918
54,1596718851097755648,elonmusk,slide twitter compani talk,2022-11-27 04:13:34+00:00,24225,252130
55,1596716236477698048,elonmusk,starri starri night,2022-11-27 04:03:10+00:00,12889,161665
56,1596704250880720898,elonmusk,tesla team complet 500 mile drive tesla semi weigh 81 000 lbs,2022-11-27 03:15:33+00:00,21729,371229
57,1596621001693200385,elonmusk,follow world cup twitter best real time coverag,2022-11-26 21:44:45+00:00,12065,193311
58,1596611595794370562,elonmusk,rt falcon 9 launch dragon,2022-11-26 21:07:22+00:00,7900,0
59,1596590805593964544,elonmusk,rt dragon separ confirm autonom dock sunday novemb 27 7 30 m et,2022-11-26 19:44:45+00:00,2944,0
60,1596590790784188416,elonmusk,rt falcon 9 s first stage land read instruct droneship,2022-11-26 19:44:42+00:00,3680,0
61,1596590767853928449,elonmusk,rt liftoff,2022-11-26 19:44:36+00:00,4404,0
62,1596427779587080195,elonmusk,simpson s predict buy twitter s26e12,2022-11-26 08:56:57+00:00,20234,288786
63,1596072934665240576,elonmusk,think cultur war,2022-11-25 09:26:55+00:00,17821,245232
64,1595956011210182656,elonmusk,thanksgiv cuisin delight symphoni flavor,2022-11-25 01:42:19+00:00,12950,267180
65,1595842114268569603,elonmusk,rt happi thanksgiv thank tesla team owner fan help acceler world s transit sustain,2022-11-24 18:09:44+00:00,4279,0
66,1595684143429550080,elonmusk,notic small sometim major improv speed twitter especi signific countri far away usa,2022-11-24 07:42:00+00:00,16998,258514
67,1595682322707267584,elonmusk,tesla full self drive beta now avail anyon north america request car screen assum,2022-11-24 07:34:46+00:00,13105,176119
68,1595630109116989440,elonmusk,hate speech impress 1 3 pre spike level congrat twitter team,2022-11-24 04:07:18+00:00,21254,263465
69,1595594047493660677,elonmusk,rt stronger roi advertis relev ad everyon new twitter solut now live,2022-11-24 01:44:00+00:00,2416,0
70,1595589549924970496,elonmusk,great thanksgiv,2022-11-24 01:26:07+00:00,40891,634174
71,1595535360863395842,elonmusk,awesom new twitter merch,2022-11-23 21:50:48+00:00,47767,559728
72,1595505413113323520,elonmusk,world cup traffic hit 20 000 tweet per second today great work twitter team manag record usag,2022-11-23 19:51:48+00:00,23150,358425
73,1595473875847942146,elonmusk,twitter offer general amnesti suspend account provid broken law engag egregi spam,2022-11-23 17:46:29+00:00,60157,267294
74,1595358165373112320,elonmusk,time hew closer truth twitter earn trust peopl,2022-11-23 10:06:41+00:00,32185,380920
75,1595339067452841984,elonmusk,best life,2022-11-23 08:50:48+00:00,18102,282024
76,1595290284136402944,elonmusk,rt deploy eutelsat 10b confirm,2022-11-23 05:36:57+00:00,3996,0
77,1595251031641755649,elonmusk,rt liftoff,2022-11-23 03:00:58+00:00,5530,0
78,1595250835096621057,elonmusk,found closet twitter hq fr,2022-11-23 03:00:12+00:00,90435,648140
79,1595209407310094336,elonmusk,rt 40k supercharg around world count,2022-11-23 00:15:34+00:00,3010,0
80,1595207476936413187,elonmusk,twitter suppos die now someth,2022-11-23 00:07:54+00:00,69895,983101
81,1594962397114023937,elonmusk,wait tweet count work,2022-11-22 07:54:03+00:00,33145,686145
82,1594866036708462593,elonmusk,tactic mistak,2022-11-22 01:31:08+00:00,9402,162448
83,1594865247323660290,elonmusk,twitter ad 1 6m daili activ user past week anoth time high,2022-11-22 01:28:00+00:00,31150,386111
84,1594861031670820864,elonmusk,hold relaunch blue verifi high confid stop imperson probabl use,2022-11-22 01:11:15+00:00,15117,243185
85,1594835418117451776,elonmusk,starlink now work high latitud,2022-11-21 23:29:28+00:00,6859,89577
86,1594828625232113664,elonmusk,tesla megapack high effect address electr demand spike power outag,2022-11-21 23:02:29+00:00,3458,43893
87,1594788419120824321,elonmusk,experi want igor,2022-11-21 20:22:43+00:00,16198,170405
88,1594773242626965505,elonmusk,fanatic alway function repress doubt dune,2022-11-21 19:22:25+00:00,10691,126378
89,1594757734267764774,elonmusk,hope judgi hall monitor stay platform pleas beg,2022-11-21 18:20:47+00:00,25647,361977
90,1594751560147312641,elonmusk,twitter fun,2022-11-21 17:56:15+00:00,44042,618269
91,1594509880840388610,elonmusk,love never die,2022-11-21 01:55:54+00:00,36043,481584
92,1594500655724609536,elonmusk,lead temptat,2022-11-21 01:19:15+00:00,93854,1099248
93,1594455929256349697,elonmusk,world cup qatar 2022 open ceremoni,2022-11-20 22:21:31+00:00,13876,131869
94,1594339820792430601,elonmusk,world cup start soon follow twitter best coverag far,2022-11-20 14:40:09+00:00,31798,495415
95,1594191387519373313,elonmusk,twitter aliv,2022-11-20 04:50:20+00:00,114920,1452676
96,1594165854605758466,elonmusk,rt insid tesla exhibit petersen automot museum open tomorrow,2022-11-20 03:08:52+00:00,5850,0
97,1594150582599589888,elonmusk,rt twitter server right now,2022-11-20 02:08:11+00:00,21231,0
98,1594131768298315777,elonmusk,peopl spoken trump reinstat vox populi vox dei,2022-11-20 00:53:25+00:00,128100,964442
99,1594078009954570240,elonmusk,entertain outcom variant occam s razor,2022-11-19 21:19:48+00:00,10504,173876
100,1593958104365993986,elonmusk,fascin watch twitter trump poll,2022-11-19 13:23:21+00:00,24146,457426
101,1593901355667582976,elonmusk,tesla fsd 10 69 3 1 go wide releas now,2022-11-19 09:37:51+00:00,6748,120276
102,1593899029531803649,elonmusk,leav twitter hq code review,2022-11-19 09:28:36+00:00,36889,464162
103,1593893237873201152,elonmusk,trump poll get 1m vote hour,2022-11-19 09:05:35+00:00,37664,618391
104,1593767953706921985,elonmusk,reinstat former presid trump,2022-11-19 00:47:45+00:00,230722,839317
105,1593727662228283393,elonmusk,first world cup match sunday watch twitter best coverag amp real time commentari,2022-11-18 22:07:39+00:00,54738,617087
106,1593673339826212864,elonmusk,new twitter polici freedom speech freedom reach negat hate tweet max deboost amp de,2022-11-18 18:31:47+00:00,42451,415536
107,1593670880676020224,elonmusk,freedom friday,2022-11-18 18:22:01+00:00,24164,384415
108,1593659832552153093,elonmusk,twitter next,2022-11-18 17:38:07+00:00,32179,516374
109,1593624195136487426,elonmusk,,2022-11-18 15:16:30+00:00,100301,792926
110,1593494261038649344,elonmusk,,2022-11-18 06:40:12+00:00,23474,343051
111,1593459801966538755,elonmusk,,2022-11-18 04:23:16+00:00,234734,2136965
112,1593459039257563136,elonmusk,,2022-11-18 04:20:14+00:00,34630,541504
113,1593455727611215872,elonmusk,hit anoth time high twitter usag lol,2022-11-18 04:07:05+00:00,46884,721818
114,1593415171149791232,elonmusk,make small fortun social media start larg one,2022-11-18 01:25:55+00:00,26366,459404
115,1593264249731620864,elonmusk,twitter open sourc news,2022-11-17 15:26:13+00:00,31537,402897
116,1593160857588232192,elonmusk,coverag ftx meltdown incompar faster better qualiti twitter old school media,2022-11-17 08:35:22+00:00,28389,316540
117,1592962254382604288,elonmusk,rt model s receiv highest overal score euro ncap vehicl test current protocol,2022-11-16 19:26:11+00:00,4102,0
118,1592771551111577600,elonmusk,rt live now era explor begin today first integr test flight rocket sp,2022-11-16 06:48:24+00:00,11792,0
119,1592734699578761219,elonmusk,rt,2022-11-16 04:21:58+00:00,9765,0
120,1592658210917609472,elonmusk,punt relaunch blue verifi novemb 29th make sure rock solid,2022-11-15 23:18:02+00:00,14992,224417
121,1592618665933156352,elonmusk,welcom back ligma amp johnson,2022-11-15 20:40:54+00:00,48575,762269
122,1592447141720780803,elonmusk,twitter news,2022-11-15 09:19:19+00:00,30824,426619
123,1592254111088771072,elonmusk,sìì,2022-11-14 20:32:17+00:00,3129,42323
124,1592228299337760768,elonmusk,recent trend promis,2022-11-14 18:49:43+00:00,8258,133506
125,1591853644944932865,elonmusk,way apolog twitter super slow mani countri app gt 1000 poor batch rpcs j,2022-11-13 18:00:58+00:00,11067,174670
126,1591851391773200384,elonmusk,roll soon twitter enabl organ identifi twitter account actual associ,2022-11-13 17:52:01+00:00,17540,233218
127,1591842546216763399,elonmusk,twitter feel increas aliv,2022-11-13 17:16:52+00:00,34705,566939
128,1591574318022299649,elonmusk,order,2022-11-12 23:31:02+00:00,6162,76673
129,1591487015845076996,elonmusk,rt join grow team instal solar powerwal,2022-11-12 17:44:07+00:00,3222,0
130,1591487006508736512,elonmusk,rt tesla solar powerwal power home amp reduc depend grid lowest price https,2022-11-12 17:44:05+00:00,2889,0
131,1591486248384102400,elonmusk,rt deploy galaxi 31 confirm,2022-11-12 17:41:04+00:00,3415,0
132,1591486131430121472,elonmusk,rt liftoff,2022-11-12 17:40:36+00:00,4630,0
133,1591334141140045824,elonmusk,,2022-11-12 07:36:39+00:00,28503,444088
134,1591326005272141826,elonmusk,twitter,2022-11-12 07:04:19+00:00,12056,100732
135,1591313397362352130,elonmusk,ftx meltdown ransack track real time twitter,2022-11-12 06:14:13+00:00,19562,218580
136,1591137416420945920,elonmusk,rt happi veteran day serv,2022-11-11 18:34:56+00:00,7736,0
137,1591132793698136064,elonmusk,rt pursuit mission today open ev connector design,2022-11-11 18:16:34+00:00,3267,0
138,1591121142961799168,elonmusk,twitter pursu goal elev citizen journal media elit tri everyth stop happen,2022-11-11 17:30:16+00:00,50221,383729
139,1591102135613390850,elonmusk,twitter hq great real pic,2022-11-11 16:14:45+00:00,12790,173077
140,1590970255064854529,elonmusk,quit day,2022-11-11 07:30:42+00:00,10254,217220
141,1590884973535711232,elonmusk,go forward account engag parodi includ parodi name bio,2022-11-11 01:51:49+00:00,28679,358252
142,1590785323105423360,elonmusk,usag twitter continu rise one thing sure bore,2022-11-10 19:15:51+00:00,29426,442997
143,1590755506112823296,elonmusk,love peopl complain twitter twitter,2022-11-10 17:17:22+00:00,108743,1328304
144,1590746581426663424,elonmusk,,2022-11-10 16:41:54+00:00,19740,323689
145,1590612193590259712,elonmusk,see far fewer bot scam spam,2022-11-10 07:47:53+00:00,9041,82869
146,1590418042353512448,elonmusk,rt,2022-11-09 18:56:24+00:00,3164,0
147,1590384919829962752,elonmusk,pleas note twitter lot dumb thing come month keep work amp chang,2022-11-09 16:44:47+00:00,40072,536183
148,1590383937284870145,elonmusk,complaint hotlin oper onlin pleas mention complaint,2022-11-09 16:40:53+00:00,25156,369203
149,1590004271625691136,elonmusk,twitter worst best,2022-11-08 15:32:13+00:00,46233,648340
150,1589791846737522688,elonmusk,,2022-11-08 01:28:07+00:00,48235,687778
151,1589784134691741696,elonmusk,twitter usag time high lol,2022-11-08 00:57:29+00:00,46424,710672
152,1589722050998210561,elonmusk,clear histor parti affili independ actual vote histori entir democrat year,2022-11-07 20:50:47+00:00,27818,368530
153,1589657032994750464,elonmusk,rt meet megafactori new megapack factori lathrop ca,2022-11-07 16:32:25+00:00,5120,0
154,1589657015575773185,elonmusk,rt view destin charger,2022-11-07 16:32:21+00:00,1814,0
155,1589639376186724354,elonmusk,independ mind voter share power curb worst excess parti therefor recommend vote,2022-11-07 15:22:16+00:00,58371,414378
156,1589631946644414467,elonmusk,time chang,2022-11-07 14:52:44+00:00,25659,340006
157,1589609169333948418,elonmusk,twitter rule evolv time current follow,2022-11-07 13:22:14+00:00,15135,104990
158,1589414958508691456,elonmusk,commit free speech extend even ban account follow plane even though direct person safeti risk,2022-11-07 00:30:30+00:00,28861,397437
159,1589413653190938624,elonmusk,twitter need becom far accur sourc inform world mission,2022-11-07 00:25:19+00:00,69768,763072
160,1589403131770974208,elonmusk,widespread verif democrat journal amp empow voic peopl,2022-11-06 23:43:30+00:00,27348,299158
161,1589390597798125568,elonmusk,go forward twitter handl engag imperson without clear specifi parodi perman suspend,2022-11-06 22:53:42+00:00,68264,648821
162,1589022495189127169,elonmusk,search within twitter remind infoseek 98 lot better pronto,2022-11-05 22:31:00+00:00,15804,263760
163,1589018654162972673,elonmusk,rt design amp manufactur actuat optimus robot,2022-11-05 22:15:44+00:00,2418,0
164,1589009644114284544,elonmusk,twitter soon add abil attach long form text tweet end absurd notepad screenshot,2022-11-05 21:39:56+00:00,50022,605058
165,1588992081308962816,elonmusk,rock,2022-11-05 20:30:08+00:00,13220,231600
166,1588945917217951746,elonmusk,,2022-11-05 17:26:42+00:00,12775,151375
167,1588750686006947840,elonmusk,trash day cost 8,2022-11-05 04:30:55+00:00,95580,1363537
168,1588739131815112704,elonmusk,power peopl,2022-11-05 03:45:01+00:00,68333,715577
169,1588722833148252160,elonmusk,rt full scale hyperloop test begun,2022-11-05 02:40:15+00:00,4836,0
170,1588671155766194176,elonmusk,regard twitter s reduct forc unfortun choic compani lose 4m day,2022-11-04 23:14:54+00:00,45936,518003
171,1588666105023041536,elonmusk,crystal clear twitter s strong commit content moder remain absolut unchang fac,2022-11-04 22:54:50+00:00,25680,290154
172,1588661987701313537,elonmusk,excel summari twitter s trust amp safeti head team,2022-11-04 22:38:28+00:00,4559,53750
173,1588639565426089984,elonmusk,rt life starbas,2022-11-04 21:09:22+00:00,7811,0
174,1588538640401018880,elonmusk,twitter massiv drop revenu due activist group pressur advertis even though noth c,2022-11-04 14:28:20+00:00,90654,700396
175,1588398244488368128,elonmusk,tini talk talk small feel come mind,2022-11-04 05:10:27+00:00,10187,163771
176,1588391903636357122,elonmusk,small talk even legal,2022-11-04 04:45:15+00:00,39946,478228
177,1588087419059916802,elonmusk,neuron realiz neuron,2022-11-03 08:35:20+00:00,20455,359127
178,1588081971221053440,elonmusk,consist billion bidirect interact per day twitter thought collect c,2022-11-03 08:13:41+00:00,14985,218399
179,1588065650387210240,elonmusk,rt entitl elit mad pay 8 month mad anyon pay 8 month,2022-11-03 07:08:50+00:00,30404,0
180,1588060509302972421,elonmusk,,2022-11-03 06:48:24+00:00,12760,165666
181,1588049737894088704,elonmusk,rt deploy eutelsat hotbird 13g confirm,2022-11-03 06:05:36+00:00,3895,0
182,1587923502354472960,elonmusk,,2022-11-02 21:43:59+00:00,35382,449276
183,1587913672801759234,elonmusk,,2022-11-02 21:04:56+00:00,37019,461735
184,1587899771091566595,elonmusk,advertis support,2022-11-02 20:09:41+00:00,30158,178218
185,1587894226695884800,elonmusk,,2022-11-02 19:47:39+00:00,178997,1885538
186,1587877870860484610,elonmusk,twitter simpli interest place internet read tweet right now,2022-11-02 18:42:40+00:00,43978,621309
187,1587873929443565572,elonmusk,attack right amp left simultan good sign,2022-11-02 18:27:00+00:00,46372,759799
188,1587853401014034435,elonmusk,pay,2022-11-02 17:05:26+00:00,50658,754839
189,1587631360025542656,elonmusk,twitter speak inner masochist,2022-11-02 02:23:07+00:00,16230,232641
190,1587627120355934208,elonmusk,complain pleas continu complain cost 8,2022-11-02 02:06:16+00:00,85628,1101823
191,1587624757364760576,elonmusk,rt stay vigil attempt manipul convers 2022 midterm read independ analysi,2022-11-02 01:56:53+00:00,2182,0
192,1587553306901184512,elonmusk,rt wow amaz,2022-11-01 21:12:58+00:00,18915,0
193,1587523701452464131,elonmusk,,2022-11-01 19:15:19+00:00,29440,506562
194,1587498907336118274,elonmusk,twitter s current lord amp peasant system blue checkmark bullshit power,2022-11-01 17:36:48+00:00,67705,607771
195,1587495390869422084,elonmusk,rt falcon heavi launch ussf 44 orbit two side booster return earth spacex s 50th mission 2022,2022-11-01 17:22:50+00:00,4942,0
196,1587442891894538240,elonmusk,sonic boom,2022-11-01 13:54:13+00:00,11495,145268
197,1587433105811722240,elonmusk,falcon heavi launch 30 min,2022-11-01 13:15:20+00:00,3523,53910
198,1587297730631696384,elonmusk,,2022-11-01 04:17:24+00:00,72226,1013394
199,1587297137099931649,elonmusk,halloween mom,2022-11-01 04:15:02+00:00,48394,1123694
200,1587286170450464770,elonmusk,rt happi halloween transformerskid instagram,2022-11-01 03:31:28+00:00,9368,0
201,1587204327873060865,elonmusk,rt falcon heavi roll ramp ahead tomorrow s target launch ussf 44 mission weather 90 favor lifto,2022-10-31 22:06:15+00:00,4844,0
202,1587129795732770824,elonmusk,dollar time someon ask trump come back platform twitter mint money,2022-10-31 17:10:05+00:00,59157,950026
203,1586918804780630016,elonmusk,bring back vine,2022-10-31 03:11:41+00:00,27213,249450
204,1586885887341645824,elonmusk,wachtel amp twitter board deliber hid evid court stay tune come,2022-10-31 01:00:53+00:00,45358,287557
205,1586871691686223872,elonmusk,fake tweet link new york time,2022-10-31 00:04:28+00:00,74906,693569
206,1586703490650284032,elonmusk,rt 20k model y built giga texa date,2022-10-30 12:56:06+00:00,4868,0
207,1586680643831836677,elonmusk,receiv email twitter actual real email autogener,2022-10-30 11:25:19+00:00,37154,528818
208,1586411481574166528,elonmusk,final truth carb amaz platform,2022-10-29 17:35:45+00:00,52248,685543
209,1586410852646674432,elonmusk,fresh bake bread amp pastri great joy life,2022-10-29 17:33:16+00:00,32982,527142
210,1586149451348910081,elonmusk,super clear made chang twitter s content moder polici,2022-10-29 00:14:33+00:00,21880,247740
211,1586108809772089345,elonmusk,ligma johnson come,2022-10-28 21:33:03+00:00,62468,667403
212,1586104694421659648,elonmusk,comedi now legal twitter,2022-10-28 21:16:42+00:00,253595,2380698
213,1586101267981426689,elonmusk,rt solar powerwal ensur never lose power even grid goe,2022-10-28 21:03:05+00:00,6247,0
214,1586059953311137792,elonmusk,twitter form content moder council wide divers viewpoint major content decis o,2022-10-28 18:18:55+00:00,57466,610609
215,1585966869122457600,elonmusk,good time roll,2022-10-28 12:09:02+00:00,88709,987842
216,1585841080431321088,elonmusk,bird freed,2022-10-28 03:49:11+00:00,352421,2478896
217,1585811291851018241,elonmusk,falcon rocket orbit seen la,2022-10-28 01:50:49+00:00,32997,450998
218,1585804896841846785,elonmusk,rt falcon 9 s first stage land cours still love droneship,2022-10-28 01:25:24+00:00,6947,0
219,1585804876851789824,elonmusk,rt liftoff,2022-10-28 01:25:20+00:00,6502,0
220,1585804859776782336,elonmusk,rt watch falcon 9 launch 53 starlink satellit,2022-10-28 01:25:16+00:00,2993,0
221,1585669811442286597,elonmusk,rt twitter headquart coffe bar,2022-10-27 16:28:38+00:00,21541,0
222,1585619322239561728,elonmusk,twitter advertis,2022-10-27 13:08:00+00:00,110595,745828
223,1585341984679469056,elonmusk,enter twitter hq sink,2022-10-26 18:45:58+00:00,183762,1391969
224,1585292083610279936,elonmusk,beauti thing twitter empow citizen journal peopl dissemin news without establish bias,2022-10-26 15:27:40+00:00,46709,379228
225,1585282193999265793,elonmusk,new york time emerg new chaotic actor global polit paper s intervent th,2022-10-26 14:48:22+00:00,12949,131529
226,1585050236120027137,elonmusk,work move land object,2022-10-25 23:26:39+00:00,4348,56251
227,1584764977457397760,elonmusk,lesson took longest unlearn,2022-10-25 04:33:08+00:00,12468,161342
228,1584717774261489665,elonmusk,διαλεκτική,2022-10-25 01:25:34+00:00,7343,104343
229,1584608031777902593,elonmusk,rt starlink now avail jamaica,2022-10-24 18:09:30+00:00,2255,0
230,1584319362294775808,elonmusk,rt falcon heavi hangar launch complex 39a,2022-10-23 23:02:25+00:00,5008,0
231,1584174386998697985,elonmusk,think decid current thing accept,2022-10-23 13:26:21+00:00,12830,121459
232,1584173256415723521,elonmusk,decid current thing real question know,2022-10-23 13:21:51+00:00,9280,122904
233,1584157532209090560,elonmusk,neuralink show amp tell now nov 30,2022-10-23 12:19:22+00:00,5058,66707
234,1583978878305173505,elonmusk,know noth forev,2022-10-23 00:29:28+00:00,22797,216098
235,1583927287690317824,elonmusk,rt border chang time,2022-10-22 21:04:27+00:00,26497,0
